"Title","Tour Destination"
"Hotel Nearby Hong Kong International Airport","Hong Kong,,Hong Kong City,Hong Kong International Airport,Aberdeen,Avenue of Stars,Big Buddha,Hong Kong Disneyland,Hong Kong Museum of Art,Hong Kong Museum of History,Hong Kong Police Museum,Hong Kong Science Museum,Hong Kong Wetland Park,Kowloon Park,Lantau,Macau,Ngong Ping 360,Ocean Park,Stanley,Statue Square,Ten Thousand Buddhas Monastery,Victoria Peak,Western Market,Wong Tai Sin Temple,,"
"Hotel Nearby Chicago Midway Airport","United States of America,Illinois,Chicago,Chicago Midway Airport,Adler Planetarium and Astronomy Museum,Art Institute of Chicago,Buckingham Fountain,Chicago Beaches,Chicago Botanic Gardens,Chicago Childrens Museum,Chicago Field Museum,Chicago History Museum,Chicago Loop,Frank Lloyd Wrights Home,Hancock Observatory,Lincoln Park,Magnificent Mile,Millennium Park,Navy Pier,Rockford,Route 66 Sign,Sears Tower (Willis Tower),Shedd Aquarium,Six Flags Great America,,"
"Hotel Nearby Chicago O Hare International","United States of America,Illinois,Chicago,Chicago O Hare International,Adler Planetarium and Astronomy Museum,Art Institute of Chicago,Buckingham Fountain,Chicago Beaches,Chicago Botanic Gardens,Chicago Childrens Museum,Chicago Field Museum,Chicago History Museum,Chicago Loop,Frank Lloyd Wrights Home,Hancock Observatory,Lincoln Park,Magnificent Mile,Millennium Park,Navy Pier,Rockford,Route 66 Sign,Sears Tower (Willis Tower),Shedd Aquarium,Six Flags Great America,,"
"Hotel Nearby San Francisco International","United States of America,California,San Francisco,San Francisco International,Alamo Square,Alcatraz,Aquarium of the Bay,Asian Art Museum of San Francisco,Cable Cars,Childrens Fairyland,Chinatown,Coit Tower,Exploratorium,Fishermans Wharf,Ghirardelli Square,Golden Gate Bridge,Golden Gate Park,Haight Ashbury,Lombard Street,Muir Woods,North Beach,Oakland Zoo,Randall Museum,Redwood National and State Park,Ripleys Believe it or Not! Museum,San Francisco MOMA,Sausalito,Six Flags Discovery Kingdom,Union Square,Winchester Mystery House,Wine Country,Yosemite National Park,,"
"Hotel Nearby Long Beach Airport","United States of America,California,Los Angeles,Long Beach Airport,Anaheim,Beach Communities,Castle Park,Celebrity Gravesites,Death Valley National Park,Disneyland Resort,Getty Center,Getty Villa,Griffith Park and Observatory,Hollywood,Knotts Berry Farm,La Brea Tar Pits,Los Angeles Zoo,Magicopolis,Medieval Times,Peach Tree Pottery,Six Flags Magic Mountain,Universal Studios Hollywood,Walt Disney Concert Hall,Warner Bros Studios,West LA,,"
"Hotel Nearby Los Angeles International","United States of America,California,Los Angeles,Los Angeles International,Anaheim,Beach Communities,Castle Park,Celebrity Gravesites,Death Valley National Park,Disneyland Resort,Getty Center,Getty Villa,Griffith Park and Observatory,Hollywood,Knotts Berry Farm,La Brea Tar Pits,Los Angeles Zoo,Magicopolis,Medieval Times,Peach Tree Pottery,Six Flags Magic Mountain,Universal Studios Hollywood,Walt Disney Concert Hall,Warner Bros Studios,West LA,,"
"Hotel Nearby San Diego International Airport","United States of America,California,San Diego,San Diego International Airport,Aquatica by Seaworld,Balboa Park,Coronado Island,Downtown San Diego,Joshua Tree National Park,Legoland California,San Diego Beaches,San Diego Wine Country,San Diego Zoo and Safari Park,SeaWorld,Tijuana, Mexico,,"
"Hotel Nearby Brussels International","Belgium,,Brussels,Brussels International,Belgian Centre of Comic Strip Art,Bruparck,Galeries Royales Saint Hubert,Grand Place (Central Square),Hotel de Ville,Manneken-Pis,Palais Royal,Royal Museum of Central Africa,Royal Museums of Fine Arts,,"
"Hotel Nearby Charleroi Airport","Belgium,,Brussels,Charleroi Airport,Belgian Centre of Comic Strip Art,Bruparck,Galeries Royales Saint Hubert,Grand Place (Central Square),Hotel de Ville,Manneken-Pis,Palais Royal,Royal Museum of Central Africa,Royal Museums of Fine Arts,,"
"Hotel Nearby Louisville International Airport","United States of America,Kentucky,Louisville,Louisville International Airport,Belle of Louisville,Cathedral of the Assumption,Churchill Downs,Fort Knox,Frankfort,Kentucky Derby Museum,Kentucky Horse Park,Kentucky Science Center,Louisville Glassworks,Mammoth Cave,Muhammad Ali Center,Thomas Edisons House,Woodford Reserve Distillery,,"
"Hotel Nearby New Orleans International","United States of America,Louisiana,New Orleans,New Orleans International,Audubon Aquarium of the Americas,Avery Island,French Quarter,Grand Isle,Hurricane Katrina Tour,Jean Lafitte National Historical Park and Preserve,Louisiana Childrens Museum,Louisiana State Museum,Mardi Gras World,Mississippi River Boat Rides,New Orleans Museum of Art,Preservation Hall,The National WWII Museum,,"
"Hotel Nearby Baton Rouge Airport","United States of America,Louisiana,Baton Rouge,Baton Rouge Airport,Lafayette,Louisiana Art and Science Museum,Old State Capitol,Rural Life Museum and Windrush Gardens,San Francisco Plantation,USS Kidd Veterans Museum,,"
"Hotel Nearby Baltimore-Washington Airport","United States of America,Maryland,Baltimore,Baltimore-Washington Airport,Baltimore and Ohio (B&O) Railroad Museum,Baltimore Museum of Art,Fort McHenry,Lacrosse Museum and National Hall of Fame,Maryland Science Center,National Aquarium,Walters Art Museum,,"
"Hotel Nearby Bermuda International Airport","Bermuda,,Hamilton,Bermuda International Airport,Bermuda Railway Trail,Botanical Gardens,Crystal Caves,Fort Hamilton,Harrington Sound,,"
"Hotel Nearby Minneapolis-St Paul International","United States of America,Minnesota,Minneapolis-St Paul,Minneapolis-St Paul International,Chain of Lakes,Mall of America,Minnesota Childrens Museum,Minnesota History Center,Minnesota Science Museum,Minnesota Zoo,Target Field,Valleyfair,Walker Art Center,,"
"Hotel Nearby Detroit Airport","United States of America,Michigan,Detroit,Detroit Airport,Ann Arbor,Automotive Hall of Fame,Detroit Historical Museum,Detroit Institute of Arts,Ludington,Motown Historical Museum,Saugatuck-Douglas,The Henry Ford Museum,,"
"Hotel Nearby Jackson International Airport","United States of America,Mississippi,Jackson Mississippi,Jackson International Airport,Elvis Presley Birthplace,Eudora Welty House,Farish Street Historical District,Mississippi Museum of Art,Mississippi Museum of Natural Science,Old Capitol Museum,Russell C. Davis Planetarium,The Governors Mansion,Vicksburg National Military Park,,"
"Hotel Nearby Boston Logan Airport","United States of America,Massachusetts,Boston,Boston Logan Airport,Black Heritage Trail,Boston Museum of Fine Arts,Boston Public Garden,Boston Tea Party Ship and Museum,Cambridge,Codzilla,Faneuil Hall Marketplace,Fenway Park,Freedom Trail,Harvard University,MIT Museum,New England Aquarium,Sam Adams Brewery,,"
"Hotel Nearby Albuquerque International Sunport","United States of America,New Mexico,Albuquerque,Albuquerque International Sunport,Albuquerque Museum,American International Rattlesnake Museum,Carlsbad Caverns,Indian Pueblo Cultural Center,Las Cruces,New Mexico Museum of Natural History and Science,Petroglyph National Monument,Roswell,Sandia Peak Tramway,Turquoise Trail,,"
"Hotel Nearby Cleveland Hopkins International","United States of America,Ohio,Cleveland,Cleveland Hopkins International,Cedar Point Amusement Park,Great Lakes Science Center,Progressive Field,Rock and Roll Hall of Fame,,"
"Hotel Nearby Philadelphia International Airport","United States of America,Delaware,,Philadelphia International Airport,,,"
"Hotel Nearby Pittsburgh International Airport","United States of America,Pennsylvania,Pittsburgh,Pittsburgh International Airport,Carnegie Museums,Fallingwater,National Aviary,PNC Park,Point State Park,,"
"Hotel Nearby Nashville International Airport","United States of America,Tennessee,Nashville,Nashville International Airport,Belle Meade Plantation,Chattanooga,Country Music Hall of Fame and Museum,Grand Ole Opry,Great Smoky Mountains National Park,Knoxville,Parthenon,Ryman Auditorium,Tennessee State Museum,,"
"Hotel Nearby Memphis International","United States of America,Tennessee,Memphis,Memphis International,Graceland,Memphis Botanic Garden,Memphis Rock n Soul Museum,Mud Island River Park,Pink Palace Museum,Stax Museum of American Soul Music,Sun Studio,,"
"Hotel Nearby Charleston International Airport","United States of America,South Carolina,Charleston,Charleston International Airport,Angel Oak,Caw Caw Interpretive Center and Charleston County Park,Charleston Museum,Fort Sumter,Plantations,Provost Dungeon and Old Exchange Building,South Carolina Aquarium,The Hunley,,"
"Hotel Nearby Richmond International Airport","United States of America,Virginia,Richmond,Richmond International Airport,Capitol Square,Lexington,Monticello,Mount Vernon,Museum and White House of the Confederacy,Richmond National Battlefield Park,Shenandoah National Park,St Johns Episcopal Church,Virginia Museum of Fine Arts,Virginia Science Museum,,"
"Hotel Nearby Baltimore-Washington International","United States of America,Washington DC,Washington DC,Baltimore-Washington International,Federal Bureau of Investigation,Ford’s Theatre,International Spy Museum,Kennedy Center,Lincoln Memorial,National Archives,National Gallery of Art,National Mall,National Zoo,Smithsonian Institution,US Capitol,US Holocaust Memorial Museum,Washington Monument,Washington National Cathedral,White House,,"
"Hotel Nearby Ronald Reagan Washington National Airport","United States of America,Washington DC,Washington DC,Ronald Reagan Washington National Airport,Federal Bureau of Investigation,Ford’s Theatre,International Spy Museum,Kennedy Center,Lincoln Memorial,National Archives,National Gallery of Art,National Mall,National Zoo,Smithsonian Institution,US Capitol,US Holocaust Memorial Museum,Washington Monument,Washington National Cathedral,White House,,"
"Hotel Nearby Washington-Dulles International","United States of America,Washington DC,Washington DC,Washington-Dulles International,Federal Bureau of Investigation,Ford’s Theatre,International Spy Museum,Kennedy Center,Lincoln Memorial,National Archives,National Gallery of Art,National Mall,National Zoo,Smithsonian Institution,US Capitol,US Holocaust Memorial Museum,Washington Monument,Washington National Cathedral,White House,,"
"Hotel Nearby Seattle-Tacoma Airport","United States of America,Washington,Seattle,Seattle-Tacoma Airport,Alaskan Ferry,Experience Music Project,Museum of Flight,Olympic National Park,Pike Place Market,Pioneer Square,Puget Sound Islands,San Juan and the Gulf Islands,Seattle Aquarium,Seattle Art Museum,Seattle Space Needle,Washington State Ferries,Woodland Park Zoo,,"
"Hotel Nearby Salt Lake City International","United States of America,Utah,Salt Lake City,Salt Lake City International,Dinosaur National Monument,Great Salt Lake,Park City,Pioneer Memorial Museum,Solitude,Temple Square,Tracy Aviary,Utah State Capitol,,"
"Hotel Nearby Dallas-Fort Worth International","United States of America,Texas,Dallas-Fort Worth,Dallas-Fort Worth International,Cattle Raisers Museum,Dallas Heritage Village,Dallas Holocaust Museum,Fort Worth Stockyards,Fort Worth Zoo,Modern Art Museum of Fort Worth,Six Flags Over Texas,Sixth Floor Museum,,"
"Hotel Nearby George Bush Intercontinental","United States of America,Texas,Houston,George Bush Intercontinental,Bayou Bend,Lyndon B. Johnson Space Center,Museum District,National Museum of Funeral History,Sam Houston Historical Park,The Orange Show,,"
"Hotel Nearby Hobby Airport","United States of America,Texas,Houston,Hobby Airport,Bayou Bend,Lyndon B. Johnson Space Center,Museum District,National Museum of Funeral History,Sam Houston Historical Park,The Orange Show,,"
"Hotel Nearby Austin-Bergstrom International","United States of America,Texas,Austin,Austin-Bergstrom International,Congress Avenue Bridge,Governors Mansion,Guadalupe Mountains National Park,Jack S. Blanton Museum of Art,Ladybird Johnson Wildflower Center,Texas State Capitol,Zilker Park,,"
"Hotel Nearby St Louis International","United States of America,Missouri,St Louis,St Louis International,Forest Park,Gateway Arch,Laumeier Sculpture Park,St Louis City Museum,,"
"Hotel Nearby Sofia Airport","Bulgaria,,Sofia,Sofia Airport,Alexander Nevsky Cathedral,Boyana Church,National Ethnographic Museum,St George Rotunda,St. Sofia Church,Vitosha Mountain,,"
"Hotel Nearby Copenhagen Airport","Denmark,,Copenhagen,Copenhagen Airport,Bakken Amusement Park,Bornholm,Christiansborg Palace,Copenhagen Historical Museums,Copenhagen Zoo,Denmark Aquarium,Esbjerg,Experimentarium,Freetown Christiania,Legoland Billund,Nyhavn Canal,Odense,Rosenborg Castle,The Little Mermaid Statue,Tivoli Gardens,,"
"Hotel Nearby Rio de Janeiro International Airport","Brazil,,Rio de Janeiro,Rio de Janeiro International Airport,Angra dos Reis,Buzios Peninsula,Copacabana,Corcovado,Estádio do Maracanã,Iguaçu Falls,Ipanema,Rocinha,Santa Teresa,Sugar Loaf,,"
"Hotel Nearby Stockholm-Arlanda International Airport","Sweden,,Stockholm,Stockholm-Arlanda International Airport,Gotland,Gröna Lund,Museum of National Antiquities,Royal Djurgården,Royal Palace and Gamla Stan,Royal Warship Vasa,Sala Silver Mine,Skansen,Stockholm Archipelago,Stockholm City Hall,,"
"Hotel Nearby Amman Airport","Jordan,,Amman,Amman Airport,Citadel Hill,Desert Castle Loop,Jerash,Madaba,Mount Nebo,Roman Theatre,The Dead Sea,,"
"Hotel Nearby Helsinki-Vantaa International Airport","Finland,,Helsinki,Helsinki-Vantaa International Airport,Helsinki Zoo,Market Square,National Museum of Finland,Santa Claus Village,Senate Square,Seurasaari Open Air Museum,Suomenlinna Fortress,Temppeliaukio Church,Uspenski Cathedral,,"
"Hotel Nearby Sao Paulo-Guarulhos International","Brazil,,Sao Paulo,Sao Paulo-Guarulhos International,Football Museum,Ibirapuera Park,Julio Prestes Cultural Center,,"
"Hotel Nearby Quebec City Airport","Canada,Quebec,Quebec City,Quebec City Airport,Battlefields Park (Plains of Abraham),Fortifications,Funicular,LÎle dOrléans,Lower Town (Basse-Ville),Montmorency Falls Park,Old Port of Montreal,Parliament Buildings,Place Royale,,"
"Hotel Nearby Dubai International Airport","United Arab Emirates,,Dubai,Dubai International Airport,Al Nasr Leisureland,Bastakiya,Bateaux Dubai Dinner Cruise,Camel Racing,Childrens City,Creekside Park,Desert Safari,Dubai Aquarium & Underwater Zoo,Dubai Creek,Dubai Dolphinarium,Dubai Mall,Dubai Museum,Dubai Souks,Grand Mosque,Hatta,Jumeirah Beach Park,Jumeirah Mosque,Kish,Musandam,Sheikh Saeed Al-Maktoum Museum,Ski Dubai,Wild Wadi,Wonderland,,"
"Hotel Nearby Seoul International Airport","South Korea,,Seoul,Seoul International Airport,Changdeokgung,Everland,Galbi Restaurants,Gyeongbokgung,Hwaseong Fortress,Incheon,Insadong,Itaewon,Jogyesa,Jongmyo Shrine,Korean DMZ,Lotte World,Namsan Park,,"
"Hotel Nearby Florence Peretola Airport","Italy,,Florence,Florence Peretola Airport,Palazzo Pitti and Giardino Boboli,Piazza del Duomo (Cathedral Square),Ponte Vecchio,Santa Croce,The Bargello (Museo Nazionale del Bargello),The Uffizi (Gallerie degli Uffizi),,"
"Hotel Nearby Salvador International Airport","Brazil,,Salvador da Bahia,Salvador International Airport,,,"
"Hotel Nearby Phnom Penh International Airport","Cambodia,,Phnom Penh,Phnom Penh International Airport,Cambodia Cooking Class,Central Market (Psah Thmay),Choeung Ek (The Killing Fields),Foreign Correspondents Club,Krong Kep,National Museum,Rantanakiri,River Dolphins,Russian Market,Shooting Ranges,Sihanoukville,The Royal Palace,Tuol Sleng Museum,,"
"Hotel Nearby Brisbane Airport","Australia,Queensland,Brisbane,Brisbane Airport,Gondwana Rainforests of Australia,Lone Pine Koala Sanctuary,Sea World,South Bank,Story Bridge,The Gabba,,"
"Hotel Nearby Riyadh Airport","Saudi Arabia,,Riyadh,Riyadh Airport,Al Murabba’a Historical Palace,Al Musmak Castle,City of old Diriyah,Kingdom Centre,The National Museum,,"
"Hotel Nearby Vancouver International","Canada,British Columbia,Vancouver,Vancouver International,Capilano Suspension Bridge,Chinatown,Commercial Drive,Gastown,Granville Island,Greater Vancouver Zoo,Grouse Mountain,Gulf Islands,Lonsdale Quay,Museum of Anthropology,Othello Tunnels,Queen Elizabeth Park,San Juan Islands,Stanley Park,Vancouver Aquarium Marine Science Centre,Vancouver Art Gallery,Vancouver Lookout at the Harbour Centre,VanDusen Botanical Garden,,"
"Hotel Nearby Keflavik International Airport","Iceland,,Reykjavik,Keflavik International Airport,Blue Lagoon,Botanical Gardens,Einar Jónsson Museum,Geysir,Gullfoss Falls,Hallgrimskirkja,Hidden People,Jökulsárlón,Thingvellir National Park,,"
"Hotel Nearby Cairns International","Australia,Queensland,Cairns,Cairns International,Bowling Green Bay National Park,Cape Tribulation,Daintree Rainforest Discovery Centre,Great Barrier Reef,Paronella Park,Riversleigh,Skyrail,The Esplanade,Tjapukai Aboriginal Cultural Park,Wildlife Dome,,"
"Hotel Nearby Dubrovnik Airport","Croatia,,Dubrovnik,Dubrovnik Airport,Cathedral Treasury,Dubrovnik City Walls,Dubrovnik Port,Dubrovnik Riviera,Elafiti Islands,Franciscan Monastery,Korcula Island,Marin Drzics House,Mljet Island,Sponza Palace,Stradun,War Photo Limited,,"
"Hotel Nearby Split Airport","Croatia,,Split,Split Airport,Archaeological Museum,Brac Island,Diocletians Palace,Hvar Island,Makarska,Sibenik,Trogir,,"
"Hotel Nearby Abu Dhabi Airport","United Arab Emirates,,Abu Dhabi,Abu Dhabi Airport,Al Hosn Palace (White Fort),Bowling, Paintball and Table Tennis,Ferrari World,Heritage Village,Hili Fun City,Hiltonia Beach Club,Liwa Oasis,Marina Mall Fun City,,"
"Hotel Nearby Al Ain International Airport","United Arab Emirates,,Abu Dhabi,Al Ain International Airport,Al Hosn Palace (White Fort),Bowling, Paintball and Table Tennis,Ferrari World,Heritage Village,Hili Fun City,Hiltonia Beach Club,Liwa Oasis,Marina Mall Fun City,,"
"Hotel Nearby Gothenburg Airport","Sweden,,Gothenburg,Gothenburg Airport,Elfsborg Fortress,Göta Canal,Göteborg Botanical Garden,Gothenburg Archipelago,Liseberg Amusement Park,,"
"Hotel Nearby Vilnius Airport","Lithuania,,Vilnius,Vilnius Airport,European Park,Gediminas Castle,Jewish Memorials,Museum of Genocide Victims,Vilnius Cathedral,,"
"Hotel Nearby Calgary Airport","Canada,Alberta,Calgary,Calgary Airport,Calaway Park,Calgary Tower,Calgary Zoo,Canada Olympic Park,Fort Calgary,Glenbow Museum,Head-Smashed-In Buffalo Jump,Heritage Park Historical Village,Moraine Lake,,"
"Hotel Nearby Cardiff Airport","United Kingdom,Wales,Cardiff,Cardiff Airport,Cardiff Castle,Gower Peninsula,Llandaff Cathedral,Pembrokeshire Coast National Park,St Fagans National History Museum,Wales Millennium Centre,,"
"Hotel Nearby Kathmandu Airport","Nepal,,Kathmandu,Kathmandu Airport,Bhaktapur,Boudhanath Stupa,Changu Narayan Temple,Durbar Square,Pashupatinath Temple,Patan,Royal Chitwan National Park,Swayambhunath Stupa,,"
"Hotel Nearby Manchester Airport","United Kingdom,England,Manchester,Manchester Airport,Bridgewater Hall,Chatsworth House,Museum of Science and Industry,Old Trafford,Peak District,,"
"Hotel Nearby Newcastle Airport","Kenya,,Nevis,Newcastle Airport,Charlestown,Horatio Nelson Museum,Oualie Beach,Pinney’s Beach,,"
"Hotel Nearby Liverpool Airport","United Kingdom,England,Liverpool,Liverpool Airport,Beatles Story Experience,Merseyside Maritime Museum,Speke Hall,Tate Liverpool,,"
"Hotel Nearby Bristol Airport","United Kingdom,England,Bristol,Bristol Airport,Bristol Cathedral,Bristol City Museum and Art Gallery,Bristol Zoo and Garden,,"
"Hotel Nearby Billings Airport","United States of America,Montana,Billings,Billings Airport,Chico Hot Springs,Custer National Forest,Missoula,Moss Mansion Historic House,Pictograph Cave State Park,Western Heritage Center,Yellowstone Art Museum,Yellowstone National Park,Zoo Montana,Big Sky,"
"Hotel Nearby Portland International Jetport","United States of America,Maine,Portland,Portland International Jetport,Kennebunkport,Old Orchard Beach,Portland Downtown Arts District,Portland Head Light,Rockland,Wadsworth-Longfellow House,,"
"Hotel Nearby Portland International Airport","United States of America,Oregon,Portland Oregon,Portland International Airport,Cannon Beach,Eugene,Hoyt Arboretum,International Rose Test Garden,Lan Su Chinese Garden,Mount Hood,Museum of Science and Industry,Oregon Zoo,Pearl District,,"
"Hotel Nearby Toronto International","Canada,Ontario,Toronto,Toronto International,Casa Loma,CN Tower,Distillery Historic District,Gardiner Museum of Ceramics,Harbourfront Centre,High Park,Hockey Hall of Fame,Jungle Cat World Wildlife Park,Kensington Market,Museum of Contemporary Canadian Art,Niagara Falls,Paramount Canadas Wonderland,Royal Ontario Museum,Toronto Islands,Toronto Zoo,,"
"Hotel Nearby Burlington International Airport","United States of America,Vermont,Burlington,Burlington International Airport,Ben and Jerrys Ice Cream Factory,Ethan Allen Homestead and Museum,Lake Champlain Chocolates,,"
"Hotel Nearby Ottawa International","Canada,Ontario,Ottawa,Ottawa International,Canadian Museum of Civilisation,Gatineau Park,Parliament Hill,,"
"Hotel Nearby Marseille Provence Airport","France,,Marseille,Marseille Provence Airport,Cassis,Château dIf,Marseille Beaches,Massif des Calanques,Palais Longchamp,,"
"Hotel Nearby Belfast City Airport","United Kingdom,Northern Ireland,Belfast,Belfast City Airport,Belfast Botanic Gardens and the Ulster Museum,Belfast Zoo,Carrick-a-Rede Rope Bridge,Cathedral Quarter,Giants Causeway,Giants Ring,St Annes Cathedral,St Georges Market,Ulster American Folk Park,,"
"Hotel Nearby Belfast International Airport","United Kingdom,Northern Ireland,Belfast,Belfast International Airport,Belfast Botanic Gardens and the Ulster Museum,Belfast Zoo,Carrick-a-Rede Rope Bridge,Cathedral Quarter,Giants Causeway,Giants Ring,St Annes Cathedral,St Georges Market,Ulster American Folk Park,,"
"Hotel Nearby Aberdeen Airport","United Kingdom,Scotland,Aberdeen,Aberdeen Airport,Aberdeen Art Gallery,Aberdeen Maritime Museum,Balmoral Castle,Brig o Balgownie,Duthie Park,Malt Whisky Trail,,"
"Hotel Nearby Lyon Airport","France,,Lyon,Lyon Airport,Ancient Theatre of Fourvière,Historical Museum of Lyon and International Puppet Museum,Lyon National Opera House,,"
"Hotel Nearby Buenos Aires International (Ezeiza)","Argentina,,Buenos Aires,Buenos Aires International (Ezeiza),Buenos Aires Botanical Gardens,Buenos Aires Zoo,Cabildo,Casa Rosada,Cathedral Metropolitana,Floralis Generica,Galileo Galilei Planetarium,La Boca,La Recoleta Cemetery,Nueve de Julio Avenue,Plaza Dorrego,Teatro Colon,,"
"Hotel Nearby Ljubljana Joze Pucnik Airport","Slovenia,,Ljubljana,Ljubljana Joze Pucnik Airport,Cathedral of St Nicholas,Joze Plecnik House,Lake Bled,Ljubljana Castle,Ljubljana Zoo,National Museum of Slovenia,Postojna Cave,Tivoli Park,Triglav National Park,,"
"Hotel Nearby Birmingham Airport","United States of America,Alabama,Birmingham Alabama,Birmingham Airport,Arlington Antebellum Home and Gardens,Birmingham Civil Rights Institute,Birmingham Zoo,Oak Mountain State Park,Russell Cave National Monument,Talladega Superspeedway,Vulcan Park,,"
"Hotel Nearby Bradley Airport","United States of America,Connecticut,Hartford,Bradley Airport,Mark Twain House and Museum,Mystic Seaport,Old State House,Wadsworth Atheneum Museum of Art,,"
"Hotel Nearby Boise Airport","United States of America,Idaho,Boise,Boise Airport,Basque Museum and Cultural Center,Bogus Basin Mountain Recreation Area,Craters of the Moon,Sun Valley,"
"Hotel Nearby Montreal Trudeau Airport","Canada,Quebec,Montreal,Montreal Trudeau Airport,Montreal Botanical Garden,Montreal Museum of Fine Arts,Olympic Park,St Joseph’s Oratory,,"
"Hotel Nearby Valencia Airport","Spain,,Valencia,Valencia Airport,City of Arts and Science,Crypt of Saint Vicente,El Carmen,Plaza de la Virgen,Silk Exchange (Lonja de la Seda),Valencia Cathedral,,"
"Hotel Nearby Indianapolis Airport","United States of America,Indiana,Indianapolis,Indianapolis Airport,Eiteljorg Museum of American Indians and Western Art,Indianapolis Motor Speedway,NCAA Hall of Champions,,"
"Hotel Nearby Taipei Airport","Taiwan,,Taipei,Taipei Airport,Chiang Kai-shek Memorial Park,Longshan Temple,National Palace Museum,Shilin Night Market,Taipei 101,Taipei Zoo,,"
"Hotel Nearby Durham Tees Valley Airport","United Kingdom,England,Durham,Durham Tees Valley Airport,Crook Hall,Durham Castle,Durham Cathedral,Durham Heritage Centre,Fowlers Yard Creative Workspaces,,"
"Hotel Nearby Ankara International Airport","Turkey,,Ankara,Ankara International Airport,Anitkabir,Ethnographic Museum,Mount Ararat,Museum of Anatolian Civilizations,Natural History Museum,Temple of Augustus,,"
"Hotel Nearby Groningen Eelde Airport","Netherlands,,Groningen,Groningen Eelde Airport,,,"
"Hotel Nearby Halifax International","Canada,Nova Scotia,Halifax,Halifax International,Citadel,Maritime Museum of the Atlantic,Memory Lane Heritage Village,,"
"Hotel Nearby Omaha Airport","United States of America,Nebraska,Omaha,Omaha Airport,Bemis Center for Contemporary Arts,Omaha Childrens Museum,Strategic Air and Space Museum,,"
"Hotel Nearby Leeds Bradford Airport","United Kingdom,England,Leeds,Leeds Bradford Airport,Abbey House Museum,Armley Mills Industrial Museum,Leeds Art Gallery,Royal Armouries Museum,Thackray Museum,,"
"Hotel Nearby Lille Airport","France,,Lille,Lille Airport,Hospice Comtesse Museum,Musée des Moulins,Notre-Dame de la Treille Cathedral,Palais des Beaux-Arts,,"
"Hotel Nearby Jeddah Airport","Saudi Arabia,,Jeddah,Jeddah Airport,Mecca,Souq Al Alawi,Taif,,"
"Hotel Nearby Oklahoma City Airport","United States of America,Oklahoma,Oklahoma City,Oklahoma City Airport,Myriad Botanical Gardens,National Cowboy and Western Heritage Museum,Oklahoma City National Memorial and Museum,Oklahoma City Zoo,Stockyards City,,"
