"Title","Tour Destination"
"Hotel in Philadelphia","United States of America,Pennsylvania,Philadelphia,Philadelphia International Airport,Brandywine Valley,Doylestown,Dutch Country,Franklin Court,Franklin Institute Science Museum,Gettysburg National Military Park,Hershey’s Chocolate World,Independence National Historical Park,Philadelphia Museum of Art,Philadelphia Zoo,Please Touch Museum,,"
"Hotel in Phnom Penh","Cambodia,,Phnom Penh,Phnom Penh International Airport,Cambodia Cooking Class,Central Market (Psah Thmay),Choeung Ek (The Killing Fields),Foreign Correspondents Club,Krong Kep,National Museum,Rantanakiri,River Dolphins,Russian Market,Shooting Ranges,Sihanoukville,The Royal Palace,Tuol Sleng Museum,,"
"Hotel in Phoenix","United States of America,Arizona,Phoenix,Phoenix Airport,Desert Botanical Garden,Heard Museum,Kingman,Lake Mead and Hoover Dam,Petrified Forest National Park,Pueblo Grande Museum and Archaeological Park,Taliesin West,The Grand Canyon,,"
"Hotel in Phuket","Thailand,,Phuket,Phuket Airport,Koh Yao Islands,Phang Nga Bay,Phuket Beaches,Similan Islands National Park,Thalang National Museum,Wat Chalong Buddhist Temple,,"
"Hotel in Pittsburgh","United States of America,Pennsylvania,Pittsburgh,Pittsburgh International Airport,Carnegie Museums,Fallingwater,National Aviary,PNC Park,Point State Park,,"
"Hotel in Port Elizabeth","South Africa,,Port Elizabeth,port Elizabeth Airport,Addo Elephant Park,Bayworld,Grahamstown,Jeffreys Bay,Market Square,Nieu-Bethesda,Shamwari Game Reserve,St Georges Park,St Francis Bay,"
"Hotel in Portland","United States of America,Maine,Portland,Portland International Jetport,Kennebunkport,Old Orchard Beach,Portland Downtown Arts District,Portland Head Light,Rockland,Wadsworth-Longfellow House,,"
"Hotel in Portland Oregon","United States of America,Oregon,Portland Oregon,Portland International Airport,Cannon Beach,Eugene,Hoyt Arboretum,International Rose Test Garden,Lan Su Chinese Garden,Mount Hood,Museum of Science and Industry,Oregon Zoo,Pearl District,,"
"Hotel in Porto","Portugal,,Porto,Porto Airport,Braganca,Espinho,Guimaraes,Igreja de Sao Francisco,Museu Nacional de Soares dos Reis,Serra de Estrela,Solar Vinho do Porto,Vila do Conde,Vila Nova de Gaia,,"
"Hotel in Prague","Czech Republic,,Prague,Prague Vaclav Havel Airport,Ceský Krumlov,Charles Bridge (Karluv Most),Franz Kafka Museum,Karlovy Vary (Karlsbad),Kostnice Ossuary,Kutna Hora,Miluniæ and Gehrys Dancing House,Museum of Communism,Old Town Square,Petrin Hill,Pilsen,Prague Astronomical Clock,Prague Toy Museum,St Vitus Cathedral,Šumava National Park,The Castle District,The Jewish Museum,Traffic Rules Playground Prosek,Vysehrad,,"
"Hotel in Quebec City","Canada,Quebec,Quebec City,Quebec City Airport,Battlefields Park (Plains of Abraham),Fortifications,Funicular,LÎle dOrléans,Lower Town (Basse-Ville),Montmorency Falls Park,Old Port of Montreal,Parliament Buildings,Place Royale,,"
"Hotel in Queenstown","New Zealand,,Queenstown,Queenstown Airport,Arrowtown,Lake Wanaka,Skyline Gondola,,"
"Hotel in Quito","Ecuador,,Quito,Quito Airport,Banos,Cotopaxi National Park,Cuenca,El Mitad del Mundo,Museo del Banco Central,Otavalo,Plaza de la Independencia,Plaza San Francisco,,"
"Hotel in Raleigh","United States of America,North Carolina,Raleigh,Raleigh-Durham International Airport,Artspace,North Carolina Museum of Art,North Carolina Museum of Natural Sciences,,"
"Hotel in Regina","Canada,Saskatchewan,Regina,Regina International Airport,,,"
"Hotel in Reykjavik","Iceland,,Reykjavik,Keflavik International Airport,Blue Lagoon,Botanical Gardens,Einar Jónsson Museum,Geysir,Gullfoss Falls,Hallgrimskirkja,Hidden People,Jökulsárlón,Thingvellir National Park,,"
"Hotel in Richmond","United States of America,Virginia,Richmond,Richmond International Airport,Capitol Square,Lexington,Monticello,Mount Vernon,Museum and White House of the Confederacy,Richmond National Battlefield Park,Shenandoah National Park,St Johns Episcopal Church,Virginia Museum of Fine Arts,Virginia Science Museum,,"
"Hotel in Rio de Janeiro","Brazil,,Rio de Janeiro,Rio de Janeiro International Airport,Angra dos Reis,Buzios Peninsula,Copacabana,Corcovado,Estádio do Maracanã,Iguaçu Falls,Ipanema,Rocinha,Santa Teresa,Sugar Loaf,,"
"Hotel in Riyadh","Saudi Arabia,,Riyadh,Riyadh Airport,Al Murabba’a Historical Palace,Al Musmak Castle,City of old Diriyah,Kingdom Centre,The National Museum,,"
"Hotel in Rome","Italy,,Rome,,Basilica di San Giovanni,Capitoline Hill,Pantheon,Roman Forum (Foro Romano),St Peters Basilica (Basilica di San Pietro),The Colosseum,The Spanish Steps and Piazza di Spagna,Trastevere,Trevi Fountain (Fontana di Trevi),Vatican City and the Sistine Chapel,Villa Doria Pamphili Park,,"
"Hotel in Rotterdam","Netherlands,,Rotterdam,Rotterdam Airport,,,"
"Hotel in Salt Lake City","United States of America,Utah,Salt Lake City,Salt Lake City International,Dinosaur National Monument,Great Salt Lake,Park City,Pioneer Memorial Museum,Solitude,Temple Square,Tracy Aviary,Utah State Capitol,,"
"Hotel in Salvador da Bahia","Brazil,,Salvador da Bahia,Salvador International Airport,,,"
"Hotel in Salzburg","Austria,,Salzburg,Salzburg Airport,Hohensalzburg Fortress,Mozarts Birthplace,Salzkammergut Lakes,Schloss Kleßheim Palace,St Peters Abbey,Swarovski Crystal World,,"
"Hotel in San Antonio","United States of America,Texas,San Antonio,San Antonio International Airport,Buckhorn Saloon and Museum,Riverwalk,Six Flags Fiesta Texas,Spanish Governors Palace,The Alamo,,"
"Hotel in San Diego","United States of America,California,San Diego,San Diego International Airport,Aquatica by Seaworld,Balboa Park,Coronado Island,Downtown San Diego,Joshua Tree National Park,Legoland California,San Diego Beaches,San Diego Wine Country,San Diego Zoo and Safari Park,SeaWorld,Tijuana, Mexico,,"
"Hotel in San Francisco","United States of America,California,San Francisco,San Francisco International,Alamo Square,Alcatraz,Aquarium of the Bay,Asian Art Museum of San Francisco,Cable Cars,Childrens Fairyland,Chinatown,Coit Tower,Exploratorium,Fishermans Wharf,Ghirardelli Square,Golden Gate Bridge,Golden Gate Park,Haight Ashbury,Lombard Street,Muir Woods,North Beach,Oakland Zoo,Randall Museum,Redwood National and State Park,Ripleys Believe it or Not! Museum,San Francisco MOMA,Sausalito,Six Flags Discovery Kingdom,Union Square,Winchester Mystery House,Wine Country,Yosemite National Park,,"
"Hotel in San Juan","Puerto Rico,,San Juan,San Juan International,Caribbean National Forest (El Yunque),Casa Bacardi Visitor Centre,Fort San Felipe del Morro,Isla Verde,La Fortaleza,Museo de Arte,Old San Juan,,"
"Hotel in Santa Fe","United States of America,New Mexico,Santa Fe,,El Rancho de las Golondrinas,Georgia OKeeffe Museum,Loretto Chapel,Museum of International Folk Art,New Mexico Museum of Art,Palace of Governors,Taos,,"
"Hotel in Santiago","Chile,,Santiago,Santiago International,Cerro San Cristóbal,Chilean Museum of Pre-Columbian Art,Mercado Central,Plaza de Armas,Valparaiso,Vina del Mar,Wine Country,,"
"Hotel in Santiago de Compostela","Spain,,Santiago de Compostela,,,,"
"Hotel in Santo Domingo","Dominican Republic,,Santo Domingo,Santo Domingo International Airport,Boca Chica,Cathedral of Santa Maria,Colonial City,Columbus Lighthouse Monument,Los Tres Ojos National Park,National Aquarium,Plaza de la Cultura,,"
"Hotel in Sao Paulo","Brazil,,Sao Paulo,Sao Paulo-Guarulhos International,Football Museum,Ibirapuera Park,Julio Prestes Cultural Center,,"
"Hotel in Savannah","United States of America,Georgia,Savannah,Savannah Airport,Darien,Davenport House,Fort Jackson,Okefenokee Swamp,Savannah History Museum,Telfair Museum of Art,Tybee Island,,"
"Hotel in Seattle","United States of America,Washington,Seattle,Seattle-Tacoma Airport,Alaskan Ferry,Experience Music Project,Museum of Flight,Olympic National Park,Pike Place Market,Pioneer Square,Puget Sound Islands,San Juan and the Gulf Islands,Seattle Aquarium,Seattle Art Museum,Seattle Space Needle,Washington State Ferries,Woodland Park Zoo,,"
"Hotel in Seoul","South Korea,,Seoul,Seoul International Airport,Changdeokgung,Everland,Galbi Restaurants,Gyeongbokgung,Hwaseong Fortress,Incheon,Insadong,Itaewon,Jogyesa,Jongmyo Shrine,Korean DMZ,Lotte World,Namsan Park,,"
"Hotel in Seville","Spain,,Seville,,Alcazar of Seville,Gibraltar,Maria Luisa Park,Museo Provincial de Bellas Artes de Sevilla,Ronda,Santa Cruz,Seville Cathedral,Sherry Bodegas,Cadiz,"
"Hotel in Shanghai","China,,Shanghai,,Shanghai Museum,The Bund,Yuyuan Gardens,,"
"Hotel in Siem Reap","Cambodia,,Siem Reap,Siem Reap International Airport,Aki Ras Landmine Museum,Angkor National Museum,Beng Mealea,Psar Chaa - Old Market,Temples of Angkor,Tonlé Sap Lake,Villages on Stilts,,"
"Hotel in Singapore","Singapore,,Singapore,Singapore Changi Airport,Asian Civilisations Museum,Bukit Timah Nature Reserve,Changi Museum,Chinatown,Chinese and Japanese Gardens,Gardens by the Bay,Geylang,Haw Par Villa,Jurong Birdpark,Kampong Gelam and Arab Street,Little India,Orchard Road,Pulau Ubin,Raffles Hotel,Sentosa Island,Singapore Art Museum,Singapore Botanical Gardens,Singapore Discovery Centre,Singapore Flyer,Singapore Zoological Gardens,Thian Hock Keng Temple,Universal Studios Singapore,,"
"Hotel in Sofia","Bulgaria,,Sofia,Sofia Airport,Alexander Nevsky Cathedral,Boyana Church,National Ethnographic Museum,St George Rotunda,St. Sofia Church,Vitosha Mountain,,"
"Hotel in Split","Croatia,,Split,Split Airport,Archaeological Museum,Brac Island,Diocletians Palace,Hvar Island,Makarska,Sibenik,Trogir,,"
"Hotel in St Louis","United States of America,Missouri,St Louis,St Louis International,Forest Park,Gateway Arch,Laumeier Sculpture Park,St Louis City Museum,,"
"Hotel in St Petersburg","Russia,,St Petersburg,St Petersburg Airport,Nevsky Prospekt,Palace Square,Pavlovsk Palace,Peter and Paul Fortress,St Isaacs Cathedral,The Winter Palace and the Hermitage Museum,Tsarskoe Selo,,"
"Hotel in Stavanger","Norway,,Stavanger,Stavanger Airport,,,"
"Hotel in Stockholm","Sweden,,Stockholm,Stockholm-Arlanda International Airport,Gotland,Gröna Lund,Museum of National Antiquities,Royal Djurgården,Royal Palace and Gamla Stan,Royal Warship Vasa,Sala Silver Mine,Skansen,Stockholm Archipelago,Stockholm City Hall,,"
"Hotel in Stuttgart","Germany,,Stuttgart,Stuttgart Airport,Kunstmuseum Stuttgart,Mercedes-Benz Museum,Mineral Baths,Old and New State Gallery,Palace Square (Schlossplatz),Porsche Museum,Wilhelma Zoo,,"
"Hotel in Swansea","United Kingdom,Wales,Swansea,,,,"
"Hotel in Sydney","Australia,New South Wales,Sydney,Sydney Airport,Blue Mountains,Broken Hill,Byron Bay,Darling Harbour,Featherdale Wildlife Park,Harbour Bridge,Hunter Region,Kings Cross,New England,Royal Botanic Gardens,Snowy Mountains,Sydney Beaches,Sydney Opera House,Sydney Tower,The Rocks,,"
"Hotel in Taipei","Taiwan,,Taipei,Taipei Airport,Chiang Kai-shek Memorial Park,Longshan Temple,National Palace Museum,Shilin Night Market,Taipei 101,Taipei Zoo,,"
"Hotel in Tampa","United States of America,Florida,Tampa,Tampa International Airport,Busch Gardens,Florida Aquarium,Henry B. Plant Museum,Museum of Science and Industry,Tampa Museum of Art,Ybor City,Clearwater Beach,"
"Hotel in Tel Aviv","Israel,,Tel Aviv,Ben-Gurion Airport,Beaches,Carmel Market,Eilat,Eretz Israel Museum (The Land of Israel Museum),Jaffa,Museum of the Jewish Diaspora (Beit Hatefutsot),Tel Aviv Museum of Art,The Underwater Observatory Marine Park,,"
"Hotel in Tenby","United Kingdom,Wales,Tenby,,,,"
"Hotel in Thessaloniki","Greece,,Thessaloniki,Thessaloniki International Airport,Churches of Thessaloniki,Mount Athos,Mount Olympus,Roman Forum,The White Tower,Thessaloniki Archaeological Museum,Vergina,,"
"Hotel in Tijuana","Mexico,,Tijuana,Tijuana International Airport,,,"
"Hotel in Tokyo","Japan,,Tokyo,,Akihabara,Edo-Tokyo Museum,Inokashira Park,Joypolis Sega,Kamakura,Meiji Jingu,Mount Fuji,Senso-ji Temple,Tokyo Disney Resort,Tokyo Imperial Palace,Tokyo National Museum,Tokyo Tower,Yasukuni Shrine,Yokohama,,"
"Hotel in Toronto","Canada,Ontario,Toronto,Toronto International,Casa Loma,CN Tower,Distillery Historic District,Gardiner Museum of Ceramics,Harbourfront Centre,High Park,Hockey Hall of Fame,Jungle Cat World Wildlife Park,Kensington Market,Museum of Contemporary Canadian Art,Niagara Falls,Paramount Canadas Wonderland,Royal Ontario Museum,Toronto Islands,Toronto Zoo,,"
"Hotel in Toulouse","France,,Toulouse,,Albi,Cite De Lespace,St Sernin Basilica,,"
"Hotel in Townsville","Australia,Queensland,Townsville,,Magnetic Island,Reef HQ Aquarium,Riverway,The Strand,,"
"Hotel in Trinidad","Cuba,,Trinidad,,Ancón Beach,Museo Histórico Municipal,Museo Romántico,Sancti Spiritus,Santa Clara,Valle de los Ingenios (Valley of the Sugar Mills),,"
"Hotel in Tromso","Norway,,Tromso,Tromso Airport,Arctic Cathedral,Polaria,Tromso Museum,,"
"Hotel in Trondheim","Norway,,Trondheim,Trondheim Airport,,,"
"Hotel in Tucson","United States of America,Arizona,Tucson,Tucson Airport,Arizona-Sonora Desert Museum,Colossal Cave Mountain Park,DeGrazia Gallery in the Sun,Kartchner Caverns State Park,Philabaum Glass,Sabino Canyon,The Mission San Xavier del Bac,Tombstone,Trail Dust Town,Tucson Botanical Gardens,Tucson Rodeo Parade Museum,University of Arizona Art Museum,Valley of the Moon,,"
"Hotel in Valencia","Spain,,Valencia,Valencia Airport,City of Arts and Science,Crypt of Saint Vicente,El Carmen,Plaza de la Virgen,Silk Exchange (Lonja de la Seda),Valencia Cathedral,,"
"Hotel in Vancouver","Canada,British Columbia,Vancouver,Vancouver International,Capilano Suspension Bridge,Chinatown,Commercial Drive,Gastown,Granville Island,Greater Vancouver Zoo,Grouse Mountain,Gulf Islands,Lonsdale Quay,Museum of Anthropology,Othello Tunnels,Queen Elizabeth Park,San Juan Islands,Stanley Park,Vancouver Aquarium Marine Science Centre,Vancouver Art Gallery,Vancouver Lookout at the Harbour Centre,VanDusen Botanical Garden,,"
"Hotel in Venice","Italy,,Venice,,Aqualandia,Basilica dei Frari,Bell Tower (Campanile di San Marco),Gallerie Accademia,Gondola Rides,Murano,Padua (Padova),Peggy Guggenheim Collection,Po Delta Natural Park,Rialto Bridge,School of St Roch,St Marks Square,The Grand Canal (Canalazzo),,"
"Hotel in Verona","Italy,,Verona,Verona Airport,Piazza delle Erbe,Ponte Scaligero,Valpolicella,Verona Arena (Arena di Verona),,"
"Hotel in Victoria Falls","Zimbabwe,,Victoria Falls,Victoria Falls Airport,Devils Pool,National Parks,Victoria Falls,,"
"Hotel in Vienna","Austria,,Vienna,Vienna International,Belvedere,Freud Museum,Giant Wheel,Haus der Musik,Hofburg,Karlskirche,Minopolis – City of Children,Museum of Fine Arts (Kunsthistorisches Museum),Natural History Museum,Schönbrunn Palace,Spanish Riding School,St Stephen’s Cathedral,The Albertina,Vienna State Opera,Wiener Prater,,"
"Hotel in Vigo","Spain,,Vigo,Vigo Airport,,,"
"Hotel in Vilnius","Lithuania,,Vilnius,Vilnius Airport,European Park,Gediminas Castle,Jewish Memorials,Museum of Genocide Victims,Vilnius Cathedral,,"
"Hotel in Warsaw","Poland,,Warsaw,Warsaw Airport,Bialowieza National Park,Museum of Warsaw,Old Town (Starego Miasta),Polish Poster Gallery,The Royal Way,,"
"Hotel in Washington DC","United States of America,Washington DC,Washington DC,,Federal Bureau of Investigation,Ford’s Theatre,International Spy Museum,Kennedy Center,Lincoln Memorial,National Archives,National Gallery of Art,National Mall,National Zoo,Smithsonian Institution,US Capitol,US Holocaust Memorial Museum,Washington Monument,Washington National Cathedral,White House,,"
"Hotel in Wellington","New Zealand,,Wellington,Wellington International Airport,Mount Victoria,Te Papa Museum,Wellington Cable Car,,"
"Hotel in Xi An","China,,Xi An,Xian Xianyang International Airport,Banpo Village Remains,Forest of Steles,Great Mosque,Huaqing Hot Springs,Qin Terracotta Army Museum,Shaanxi Provincial History Museum,,"
"Hotel in York","United Kingdom,England,York,,Castle Howard,Jorvik Viking Centre,York Dungeons,York Minster,,"
"Hotel in Zagreb","Croatia,,Zagreb,,Andautonia Archaeological Park,Croatian History Museum,Croatian National Theatre,Krk Island,Plitvice Lakes National Park,Rijeka,Town Squares,Trakoscan Castle,,"
"Hotel in Zurich","Switzerland,,Zurich,Zurich Airport,Centre Le Corbusier,Fraumünster Church,Kunsthaus Zurich (Fine Arts Museum),Museum of Design Zurich,Niederdorf,Polybahn and Rigiblick Funiculars,Swiss Alps,Swiss National Museum,Zurich Zoo,,"
"Hotel Nearby Acapulco","Mexico,,Pacific Coast,Puerto Vallarta Airport,,Acapulco,"
"Hotel Nearby Agios Nikolaos","Greece,,Crete,,Crete Aquarium,Gortyna,Heraklion Archaeological Museum,Historical Museum of Crete,Lido Waterpark,Limnoupolis Waterpark,Monastery of Arkádhi,Phaistos,The Palace of Knossos,The Samaria Gorge,Agios Nikolaos,"
"Hotel Nearby Aix-en-Provence","France,,Provence,,Châteauneuf-du-Pape,Orange,Saint Rémy de Provence,Aix-en-Provence,"
"Hotel Nearby Ajaccio","France,,Corsica,Calvi – Sainte Catherine Airport,Balagne,Bastia,Bonifacio,Cap Corse,Corte,Filitosa,Les Calanques,Porto,Porto-Vecchio,Scandola Nature Reserve,Ajaccio,"
"Hotel Nearby Alanya","Turkey,,Mediterranean Coast,,,Alanya,"
"Hotel Nearby Albufeira","Portugal,,The Algarve,Faro Airport,,Albufeira,"
"Hotel Nearby Alcudia","Spain,,Mallorca,Palma de Mallorca Airport,Alcudia (Old Town),Aqualand Mallorca,Arta,Castell dAlaro,Katmandu Park,Marineland,Pollensa,Santuari de Lluc,Soller,Valldemossa,Alcudia,"
"Hotel Nearby Altea","Spain,,Costa Blanca,Alicante Airport,Castell de Santa Barbara,Elche,Isla Tabarca,Museo de Arte Contemporaneo de Alicante,Terra Mitica,Altea,"
"Hotel Nearby Altinkum","Turkey,,Aegean Coast,,Ancient Troy,Ephesus,Pamukkale,Altinkum,"
"Hotel Nearby Antalya","Turkey,,Mediterranean Coast,,,Antalya,"
"Hotel Nearby Aspen","United States of America,Colorado,Rocky Mountains,,,Aspen,"
"Hotel Nearby Atlantic City","United States of America,New Jersey,New Jersey Shore,Atlantic City International,,Atlantic City,"
"Hotel Nearby Bansko","Bulgaria,,Mountains,,Momchilovtsi,Pirin National Park,Rila Monastery,Bansko,"
"Hotel Nearby Bavaro","Dominican Republic,,East Coast,Punta Cana International Airport,,Bavaro,"
"Hotel Nearby Beaver Creek","United States of America,Colorado,Rocky Mountains,,,Beaver Creek,"
"Hotel Nearby Belek","Turkey,,Mediterranean Coast,,,Belek,"
"Hotel Nearby Benidorm","Spain,,Costa Blanca,Alicante Airport,Castell de Santa Barbara,Elche,Isla Tabarca,Museo de Arte Contemporaneo de Alicante,Terra Mitica,Benidorm,"
"Hotel Nearby Biarritz","France,,Basque Country,,Bayonne,Lourdes,Pau,The Pyrenees,Biarritz,"
"Hotel Nearby Big Sky","United States of America,Montana,Billings,Billings Airport,Chico Hot Springs,Custer National Forest,Missoula,Moss Mansion Historic House,Pictograph Cave State Park,Western Heritage Center,Yellowstone Art Museum,Yellowstone National Park,Zoo Montana,Big Sky,"
"Hotel Nearby Blanes","Spain,,Costa Brava,Girona Airport,Banyoles,Garrotxa Nature Reserve,Girona,Salvador Dali Museum House,The Medes Islands,Blanes,"
"Hotel Nearby Boca Raton","United States of America,Florida,Gold Coast,Palm Beach International Airport,Gumbo Limbo Environmental Complex,Marine Life Center of Juno Beach,Norton Museum of Art,Seminole Reservation,Boca Raton,"
"Hotel Nearby Bodrum","Turkey,,Aegean Coast,,Ancient Troy,Ephesus,Pamukkale,Bodrum,"
"Hotel Nearby Borovets","Bulgaria,,Mountains,,Momchilovtsi,Pirin National Park,Rila Monastery,Borovets,"
"Hotel Nearby Branson","United States of America,Missouri,Kansas City,Kansas City International,,Branson,"
"Hotel Nearby Breckenridge","United States of America,Colorado,Rocky Mountains,,,Breckenridge,"
"Hotel Nearby Cadiz","Spain,,Seville,,Alcazar of Seville,Gibraltar,Maria Luisa Park,Museo Provincial de Bellas Artes de Sevilla,Ronda,Santa Cruz,Seville Cathedral,Sherry Bodegas,Cadiz,"
"Hotel Nearby Cala dOr","Spain,,Mallorca,Palma de Mallorca Airport,Alcudia (Old Town),Aqualand Mallorca,Arta,Castell dAlaro,Katmandu Park,Marineland,Pollensa,Santuari de Lluc,Soller,Valldemossa,Cala dOr,"
"Hotel Nearby Cala Millor","Spain,,Mallorca,Palma de Mallorca Airport,Alcudia (Old Town),Aqualand Mallorca,Arta,Castell dAlaro,Katmandu Park,Marineland,Pollensa,Santuari de Lluc,Soller,Valldemossa,Cala Millor,"
"Hotel Nearby Calas de Mallorca","Spain,,Mallorca,Palma de Mallorca Airport,Alcudia (Old Town),Aqualand Mallorca,Arta,Castell dAlaro,Katmandu Park,Marineland,Pollensa,Santuari de Lluc,Soller,Valldemossa,Calas de Mallorca,"
"Hotel Nearby Caleta de Fuste","Spain,,Fuerteventura,Fuerteventura Airport,Baku Water Park,Beaches on Fuerteventura,Betancuria,El Cotillo,Fuerteventura Oasis Park,La Oliva,Puerto del Rosario,Caleta de Fuste,"
"Hotel Nearby Calis","Turkey,,Mediterranean Coast,,,Calis,"
"Hotel Nearby Can Picafort","Spain,,Mallorca,Palma de Mallorca Airport,Alcudia (Old Town),Aqualand Mallorca,Arta,Castell dAlaro,Katmandu Park,Marineland,Pollensa,Santuari de Lluc,Soller,Valldemossa,Can Picafort,"
"Hotel Nearby Cancun","Mexico,,Yucatan Peninsula,Merida-Rejon Airport,,Cancun,"
"Hotel Nearby Cannes","France,,Cote d Azur,,Biot,Côte dAzur Beaches,Èze,Ile St Honorat & Ile St Marguerite,La Croisette,St Tropez and Surrounds,Cannes,"
"Hotel Nearby Cascais","Portugal,,Costa do Estoril,,,Cascais,"
"Hotel Nearby Cerro Catedral","Argentina,,The Andes,,,Cerro Catedral,"
"Hotel Nearby Chamonix","France,,French Alps,,Aix-les-Bains,Annecy,Briançon,Evian-les-Bains,Grenoble,Talloires,Chamonix,"
"Hotel Nearby Clearwater Beach","United States of America,Florida,Tampa,Tampa International Airport,Busch Gardens,Florida Aquarium,Henry B. Plant Museum,Museum of Science and Industry,Tampa Museum of Art,Ybor City,Clearwater Beach,"
"Hotel Nearby Cocoa Beach","United States of America,Florida,Orlando,,Discovery Cove Orlando,Fantasy of Flight,Gatorland,Kennedy Space Centre,Orlando Museum of Art,Orlando Odditorium,SeaWorld Aquatica,SeaWorld Orlando,The Holy Land Experience,Universal Studios Florida,Walt Disney World,Wet n Wild Orlando,Wizarding World of Harry Potter,Cocoa Beach,"
"Hotel Nearby Conil de la Frontera","Spain,,Costa de la Luz,,,Conil de la Frontera,"
"Hotel Nearby Copper Mountain","United States of America,Colorado,Rocky Mountains,,,Copper Mountain,"
"Hotel Nearby Corralejo","Spain,,Fuerteventura,Fuerteventura Airport,Baku Water Park,Beaches on Fuerteventura,Betancuria,El Cotillo,Fuerteventura Oasis Park,La Oliva,Puerto del Rosario,Corralejo,"
"Hotel Nearby Cortina d Ampezzo","Italy,,Italian Alps,,,Cortina d Ampezzo,"
"Hotel Nearby Costa Teguise","Spain,,Lanzarote,Lanzarote Airport,Arrecife Museum of Contemporary Art,La Cueva de los Verdes,The Cactus Garden,Timanfaya National Park,Costa Teguise,"
"Hotel Nearby Courchevel","France,,French Alps,,Aix-les-Bains,Annecy,Briançon,Evian-les-Bains,Grenoble,Talloires,Courchevel,"
"Hotel Nearby Courmayeur","Italy,,Italian Alps,,,Courmayeur,"
"Hotel Nearby Cozumel","Mexico,,Yucatan Peninsula,Merida-Rejon Airport,,Cozumel,"
"Hotel Nearby Crested Butte","United States of America,Colorado,Rocky Mountains,,,Crested Butte,"
"Hotel Nearby Dalyan","Turkey,,Mediterranean Coast,,,Dalyan,"
"Hotel Nearby Davos","Switzerland,,Swiss Alps,,Crans-Montana,Grindelwald,Leysin,Veysonnaz,Davos,"
"Hotel Nearby Daytona Beach","United States of America,Florida,Orlando,,Discovery Cove Orlando,Fantasy of Flight,Gatorland,Kennedy Space Centre,Orlando Museum of Art,Orlando Odditorium,SeaWorld Aquatica,SeaWorld Orlando,The Holy Land Experience,Universal Studios Florida,Walt Disney World,Wet n Wild Orlando,Wizarding World of Harry Potter,Daytona Beach,"
"Hotel Nearby Disneyland Paris","France,,Paris,,Aquaboulevard,Arc de Triomphe,Disneyland Paris,Eiffel Tower,Fontainebleau,France Miniature,Jardin des Plantes,Le Jardin dAcclimatation,Les Invalides,Louvre,Musée dOrsay,Musée National dHistoire Naturelle,Musée National Picasso,Musée Rodin,Notre-Dame,Parc Asterix,Pompidou Centre,Versailles,Disneyland Paris,"
"Hotel Nearby El Arenal","Spain,,Mallorca,Palma de Mallorca Airport,Alcudia (Old Town),Aqualand Mallorca,Arta,Castell dAlaro,Katmandu Park,Marineland,Pollensa,Santuari de Lluc,Soller,Valldemossa,El Arenal,"
"Hotel Nearby El Gouna","Egypt,,The Sinai Peninsula and the Red Sea,Hurghada Airport,,El Gouna,"
"Hotel Nearby Ensenada","Mexico,,Baja California,,,Ensenada,"
"Hotel Nearby Estoril","Portugal,,Costa do Estoril,,,Estoril,"
"Hotel Nearby Faliraki","Greece,,Rhodes,Rhodes Diagoros International Airport,Acropolis of Rhodes,Filerimos Hill,Karpathos,Marine Aquarium,Petaloudes - Valley of the Butterflies,Rhodes Beaches,Rhodes Old Town,Faliraki,"
"Hotel Nearby Fernie Alpine Resort","Canada,British Columbia,Ski Resorts,,,Fernie Alpine Resort,"
"Hotel Nearby Fethiye","Turkey,,Mediterranean Coast,,,Fethiye,"
"Hotel Nearby Flaine","France,,French Alps,,Aix-les-Bains,Annecy,Briançon,Evian-les-Bains,Grenoble,Talloires,Flaine,"
"Hotel Nearby Fort Myers Beach","United States of America,Florida,Gulf Coast,,Edison and Ford Winter Estates,Koreshan State Historic Site,Lee County Manatee Park,Shell Factory and Nature Park,Southwest Florida Museum of History,Fort Myers Beach,"
"Hotel Nearby Golden Beach","Greece,,Thassos,Kavala Airport,Prinos Streetmarket,Thassos Beaches,Theologos,Golden Beach,"
"Hotel Nearby Golden Sands","Bulgaria,,Black Sea Coast,,,Golden Sands,"
"Hotel Nearby Gstaad","Switzerland,,Bernese Oberland,Bern Belp Airport,Bern,Glacier Express,Interlaken,Gstaad,"
"Hotel Nearby Hania","Greece,,Crete,,Crete Aquarium,Gortyna,Heraklion Archaeological Museum,Historical Museum of Crete,Lido Waterpark,Limnoupolis Waterpark,Monastery of Arkádhi,Phaistos,The Palace of Knossos,The Samaria Gorge,Hania,"
