"Title","Tour Destination"
"Hotel in United States of America","United States of America,,Adirondacks,Albuquerque,Amarillo,Anchorage,Annapolis,Asheville,Atlanta,Austin,Baltimore,Baton Rouge,Big Island,Billings,Biloxi,Birmingham Alabama,Black Hills,Boise,Boston,Burlington,Cape Cod,Cascade Mountain Range,Central Coast,Charleston,Charleston West Virginia,Charlotte,Cheyenne,Chicago,Chincoteague Island,Cleveland,Cody,Colorado Springs,Dallas-Fort Worth,Denver,Des Moines,Detroit,Door County,Duluth,Eastern Shore,Fairbanks,Fargo,Florida Keys,Fort Lauderdale,Galveston,Gold Coast,Grand Strand and Myrtle Beach,Gulf Coast,Gulfport,Harpers Ferry,Hartford,Honolulu,Houston,Hudson Valley and the Catskills,Indianapolis,Iowa City,Jackson Mississippi,Jackson Wyoming,Jacksonville,Juneau,Kansas City,Kauai,Ketchikan,Lake Erie Islands,Lanai,Las Vegas,Little Rock,Long Island,Los Angeles,Louisville,Mackinaw City,Madison,Maine Ski Resorts,Manchester NH,Maui,Memphis,Miami,Milwaukee,Minneapolis-St Paul,Mobile,Molokai,Montgomery,Montgomery County,Montpelier,Mount Desert Island,Nashville,Natchez,New Haven,New Jersey Shore,New Orleans,New York City,Newport,Norfolk,North Carolina Coast,North Coast Redwoods District,Oahu,Oklahoma City,Omaha,Orlando,Pensacola,Philadelphia,Phoenix,Pittsburgh,Portland,Portland Oregon,Providence,Raleigh,Reno,Richmond,Rocky Mountains,Salt Lake City,San Antonio,San Diego,San Francisco,San Jose,Santa Fe,Savannah,Seattle,Sedona,Shenandoah Valley,Skagway,Southern National Parks,Springfield,St Louis,St Petersburg Florida,Tampa,The Berkshire Hills,The Inside Passage,Tucson,Tulsa,Vermont Ski Resorts,Virginia Coast,Washington DC,West Okoboji Lake,Western Maryland,Western New York State,Wilmington,,Adler Planetarium and Astronomy Museum,Adventuredome,Alamo Square,Alaska Native Heritage Center,Alaskan Ferry,Alaskan Ferry,Albuquerque Museum,Alcatraz,Amarillo Museum of Art,Amelia Island,American International Rattlesnake Museum,American Museum of Natural History,Anaheim,Anchorage Museum of History and Art,Angel Oak,Ann Arbor,Aquarium of the Bay,Aquatica by Seaworld,Arizona-Sonora Desert Museum,Arkansas Governors Mansion,Arlington Antebellum Home and Gardens,Art Institute of Chicago,Artspace,Asian Art Museum of San Francisco,Atlanta Botanical Garden,Atlanta History Center,Atlantic Beach,Audubon Aquarium of the Americas,Audubon House and Tropical Gardens,Automotive Hall of Fame,Avery Island,Badlands National Park,Balboa Park,Bald Head Island,Baldwin Home Museum,Baltimore and Ohio (B&O) Railroad Museum,Baltimore Museum of Art,Basque Museum and Cultural Center,Bayou Bend,Beach Communities,Bellagio Hotel and Casino,Belle Meade Plantation,Belle of Louisville,Bemis Center for Contemporary Arts,Ben and Jerrys Ice Cream Factory,Benefit Street,Birmingham Civil Rights Institute,Birmingham Zoo,Biscayne National Park,Bishop Museum,Black Heritage Trail,Block Island,Blue Ridge Parkway,Bogus Basin Mountain Recreation Area,Boston Museum of Fine Arts,Boston Public Garden,Boston Tea Party Ship and Museum,Boulder,Boundary Waters Canoe Area,Brandywine Valley,Broadway,Brooklyn Bridge,Brooklyn Childrens Museum,Buckhorn Saloon and Museum,Buckingham Fountain,Buffalo,Buffalo Bills,Busch Gardens,Butterfly Conservatory,Cable Cars,Cambridge,Cannon Beach,Cape Cod Lighthouses,Capitol Square,Carlsbad Caverns,Carnegie Museums,Castle Park,Cathedral of the Assumption,Cattle Raisers Museum,Caw Caw Interpretive Center and Charleston County Park,Cedar Point Amusement Park,Celebrity Gravesites,Central Park,Central Park Zoo,Chain of Lakes,Charleston Museum,Chattanooga,Chicago Beaches,Chicago Botanic Gardens,Chicago Childrens Museum,Chicago Field Museum,Chicago History Museum,Chicago Loop,Chico Hot Springs,Childrens Fairyland,Chinatown,Churchill Downs,Clinton Presidential Center,Codzilla,Coit Tower,Colonial Michilimackinac,Colossal Cave Mountain Park,Coney Island,Congress Avenue Bridge,Coral Castle,Coronado Island,Country Music Hall of Fame and Museum,Crandon Park Beach,Crane Point,Craters of the Moon,Crazy Horse Memorial,Custer National Forest,Dallas Heritage Village,Dallas Holocaust Museum,Darien,Davenport House,Deadwood,Death Valley National Park,DeGrazia Gallery in the Sun,Delaware Art Museum,Delaware Museum of Natural History,Denali National Park and Preserve,Denver Art Museum,Denver Mint,Denver Museum of Nature and Science,Desert Botanical Garden,Detroit Historical Museum,Detroit Institute of Arts,Diamond Head Crater,Dig This,Dinosaur National Monument,Dinosaur National Monument,Discovery Cove Orlando,Disneyland Resort,Dolphin Research Center,Don Harrington Discovery Center,Downtown San Diego,Doylestown,Dutch Country,Ebenezer Baptist Church,Edison and Ford Winter Estates,Eiteljorg Museum of American Indians and Western Art,El Rancho de las Golondrinas,Elitch Gardens Theme Park,Ellis Island,Elvis Presley Birthplace,Empire State Building,Ernest Hemingway Home and Museum,Ethan Allen Homestead and Museum,Eudora Welty House,Eugene,Everglades National Park,Experience Music Project,Exploratorium,Fallingwater,Faneuil Hall Marketplace,Fantasy of Flight,Farish Street Historical District,Federal Bureau of Investigation,Fenway Park,Fernbank Museum of Natural History,Finger Lakes,Fishermans Wharf,Florida Aquarium,Ford’s Theatre,Forest Park,Fort Jackson,Fort Knox,Fort Mackinac,Fort McHenry,Fort Sumter,Fort Worth Stockyards,Fort Worth Zoo,Frank Lloyd Wrights Home,Frankfort,Franklin Court,Franklin Institute Science Museum,Freedom Schooner Amistad,Freedom Trail,Fremont Street Experience,French Quarter,Gateway Arch,Gatorland,Georgia Aquarium,Georgia Mountains,Georgia OKeeffe Museum,Getty Center,Getty Villa,Gettysburg National Military Park,Ghirardelli Square,Glacier Bay National Park,Glensheen Mansion,Gold Coast Railroad Museum,Golden Gate Bridge,Golden Gate Park,Governors Mansion,Graceland,Grand Canyon,Grand Central Station,Grand Isle,Grand Ole Opry,Grand Teton National Park,Grand Village of the Natchez Indians,Great Lakes Science Center,Great Lakes Shipwreck Museum,Great Salt Lake,Great Smoky Mountains National Park,Great Smoky Mountains National Park,Greenwich Village,Griffith Park and Observatory,Guadalupe Mountains National Park,Gulf Islands National Seashore,Gumbo Limbo Environmental Complex,Hagley Museum and Library,Haight Ashbury,Haleakala National Park,Hana Highway,Hancock Observatory,Harvard University,Hawaii Volcanoes National Park,Heard Museum,Hearst Castle,Henry B. Plant Museum,Hershey’s Chocolate World,High Museum of Art,Hilo,Historic Mill Creek Discovery Park,History Colorado Center,Hollywood,Honolulus Chinatown,Hoover Dam,Hot Springs,Hoyt Arboretum,Hubbard Glacier,Hulihee Palace,Hurricane Katrina Tour,Imagine It! Childrens Museum of Atlanta,Imperial Palace Auto Collection,Independence National Historical Park,Indian Pueblo Cultural Center,Indianapolis Motor Speedway,International Rose Test Garden,International Spy Museum,International Tennis Hall of Fame,Iolani Palace,Jack S. Blanton Museum of Art,Jean Lafitte National Historical Park and Preserve,John Brown House,Jonesboro,Joshua Tree National Park,Jungle Island,Kalalau Trail,Kartchner Caverns State Park,Kennebunkport,Kennedy Center,Kennedy Space Centre,Kennesaw Mountain Battlefield,Kentucky Derby Museum,Kentucky Horse Park,Kentucky Science Center,Ketchikan,Key Largo,Key West Lighthouse Museum,Kingman,Kitty Hawk,Knights Action Park and Caribbean Water Adventure,Knotts Berry Farm,Knoxville,Kona Coffee Museum and Farm,Koreshan State Historic Site,La Brea Tar Pits,Lacrosse Museum and National Hall of Fame,Ladybird Johnson Wildflower Center,Lafayette,Lake Champlain Chocolates,Lake Mead and Hoover Dam,Lambeau Field,Lan Su Chinese Garden,Las Cruces,Laumeier Sculpture Park,Lee County Manatee Park,Legoland California,Lexington,Lincoln Library and Museum,Lincoln Memorial,Lincoln Park,Lincoln Road Mall,Lincolns Home,Linville Caverns,Little Rock Nine Memorial,Lombard Street,Loretto Chapel,Los Angeles Zoo,Louisiana Art and Science Museum,Louisiana Childrens Museum,Louisiana State Museum,Louisville Glassworks,Ludington,Lyndon B. Johnson Space Center,Mackinac Island,Magicopolis,Magnificent Mile,Mall of America,Mammoth Cave,Mandalay Bay,Marathon,Mardi Gras World,Marine Life Center of Juno Beach,Mark Twain House and Museum,Marthas Vineyard,Martin Luther King Jr National Historic Site,Maryland Science Center,Maui Ocean Centre,Medieval Times,Memphis Botanic Garden,Memphis Rock n Soul Museum,Mendenhall Glacier,Mesa Verde National Park,Metropolitan Museum of Art,MGM Grand,Miami Beaches,Miami Childrens Museum,Miami Science Museum,Miami Seaquarium,Mill Iron Ranch,Millennium Park,Miller Brewing Company,Miller Park,Minnesota Childrens Museum,Minnesota History Center,Minnesota Science Museum,Minnesota Zoo,Mississippi Museum of Art,Mississippi Museum of Natural Science,Mississippi River Boat Rides,Missoula,MIT Museum,Mitchell Park Horticultural Conservatory,Modern Art Museum of Fort Worth,Monetary Museum at the Federal Reserve Bank,Monterey,Monticello,Moss Mansion Historic House,Motown Historical Museum,Mount Evans,Mount Hood,Mount Rainier National Park,Mount Rushmore,Mount St. Helens,Mount Vernon,Mud Island River Park,Muhammad Ali Center,Muir Woods,Museum and White House of the Confederacy,Museum District,Museum of Flight,Museum of International Folk Art,Museum of Modern Art,Museum of Newport History,Museum of Science and Industry,Museum of Science and Industry,Museum of Yachting,Myriad Botanical Gardens,Mystic Seaport,Nantucket,Napali Coast State Wilderness Park,Natchez Churches,Natchez Historic Houses,Natchez Trace Parkway,Natchez Under-the-Hill,National Aquarium,National Archives,National Aviary,National Cowboy and Western Heritage Museum,National Gallery of Art,National Key Deer Refuge,National Mall,National Museum of American Illustration,National Museum of Funeral History,National Museum of Naval Aviation,National Zoo,Navy Pier,NCAA Hall of Champions,New England Aquarium,New Mexico Museum of Art,New Mexico Museum of Natural History and Science,New Orleans Museum of Art,Newport Mansions,Niagara Falls,North Beach,North Carolina Museum of Art,North Carolina Museum of Natural Sciences,Norton Museum of Art,Oahu Beaches,Oak Mountain State Park,Oak Ridge Cemetery,Oakland Zoo,Okefenokee Swamp,Oklahoma City National Memorial and Museum,Oklahoma City Zoo,Old Capitol Museum,Old Orchard Beach,Old State Capitol,Old State House,Olympic National Park,Omaha Childrens Museum,Oregon Zoo,Orlando Museum of Art,Orlando Odditorium,Pacific Tsunami Museum,Palace of Governors,Palo Duro Canyon,Panama City,Park City,Parthenon,Peabody Museum of Natural History,Peach Tree Pottery,Pearl District,Petrified Forest National Park,Petroglyph National Monument,Philabaum Glass,Philadelphia Museum of Art,Philadelphia Zoo,Pictograph Cave State Park,Pigeon Key,Pike Place Market,Pink Palace Museum,Pinnacles National Monument,Pioneer Memorial Museum,Pioneer Square,Plantations,Please Touch Museum,PNC Park,Point State Park,Polynesian Cultural Centre,Portland Downtown Arts District,Portland Head Light,Preservation Hall,Progressive Field,Provost Dungeon and Old Exchange Building,Pueblo Grande Museum and Archaeological Park,Puget Sound Islands,Puuhonua O Honaunau National Historical Park,Radio City Music Hall,Randall Museum,Red Rock Canyon,Redwood National and State Park,Rhode Island School of Design Museum,Richmond National Battlefield Park,Ripleys Believe it or Not! Museum,Riverwalk,Rock and Roll Hall of Fame,Rockefeller Centre,Rockford,Rockland,Rocky Mountain National Park,Roger Williams Park Zoo,Roswell,Route 66 Sign,Rural Life Museum and Windrush Gardens,Russell C. Davis Planetarium,Russell Cave National Monument,Ryman Auditorium,Sabino Canyon,Sam Adams Brewery,Sam Houston Historical Park,San Diego Beaches,San Diego Wine Country,San Diego Zoo and Safari Park,San Francisco MOMA,San Francisco Plantation,San Juan and the Gulf Islands,Sandia Peak Tramway,Santa Barbara,Santa Cruz,Santa Cruz Beach Boardwalk,Saugatuck-Douglas,Sausalito,Savannah History Museum,Sears Tower (Willis Tower),Seattle Aquarium,Seattle Art Museum,Seattle Space Needle,SeaWorld,SeaWorld Aquatica,SeaWorld Orlando,Seminole Reservation,Shedd Aquarium,Shell Factory and Nature Park,Shenandoah National Park,Six Flags Discovery Kingdom,Six Flags Fiesta Texas,Six Flags Great America,Six Flags Magic Mountain,Six Flags Over Georgia,Six Flags Over Texas,Sixth Floor Museum,Ski resorts,Smithsonian Institution,Snoqualmie Falls,Solitude,South Carolina Aquarium,Southwest Florida Museum of History,Spanish Governors Palace,Spanish Monastery,Split Rock Lighthouse,St Johns Episcopal Church,St Louis City Museum,St Patricks Cathedral,State Capitol,Staten Island Ferry,Stax Museum of American Soul Music,Stockyards City,Stone Mountain Park,Strategic Air and Space Museum,Sun Studio,Surfing in Oahu,Taliesin West,Talladega Superspeedway,Tallahassee,Tampa Museum of Art,Taos,Target Field,Tarrytown,Telfair Museum of Art,Temple Square,Tennessee State Museum,Texas State Capitol,The Alamo,The Delaware Contemporary,The Fox Theatre,The Frick Collection,The Gorge Amphitheater,The Governors Mansion,The Grand Canyon,The Grand Canyon,The Guggenheim Museum,The Henry Ford Museum,The Holy Land Experience,The House on the Rock,The Hunley,The Luxor,The Mirage,The Mission San Xavier del Bac,The National WWII Museum,The Orange Show,The Statue of Liberty,Thomas Edisons House,Tijuana, Mexico,Times Square,Tombstone,Touro Synagogue,Tracy Aviary,Trail Dust Town,Treasure Island,Trump-Wollman Rink,Tucson Botanical Gardens,Tucson Rodeo Parade Museum,Turner Field,Turquoise Trail,Tybee Island,Union Square,Universal Studios Florida,Universal Studios Hollywood,University of Arizona Art Museum,US Capitol,US Holocaust Memorial Museum,USS Arizona Memorial Museum,USS Kidd Veterans Museum,Utah State Capitol,Valley of Fire State Park,Valley of the Moon,Valley of the Temples,Valleyfair,Venetian Hotel and Casino,Vicksburg National Military Park,Virginia Museum of Fine Arts,Virginia Science Museum,Vizcaya Villa,Vulcan Park,Wadsworth Atheneum Museum of Art,Wadsworth-Longfellow House,Waikiki Aquarium,Walker Art Center,Wall Street,Walt Disney Concert Hall,Walt Disney World,Walters Art Museum,Warner Bros Studios,Washington Monument,Washington National Cathedral,Washington State Ferries,Waterplace Park,West LA,Western Heritage Center,Wet n Wild Orlando,Whalers Village Museum,White House,Wilmington,Winchester Mystery House,Wine Country,Wisconsin Dells,Wizarding World of Harry Potter,Wolfsonian Museum,Woodford Reserve Distillery,Woodland Park Zoo,World Of Coca-Cola,World Trade Center - Ground Zero,Yale University,Ybor City,Yellowstone Art Museum,Yellowstone National Park,Yellowstone National Park,Yosemite National Park,Zilker Park,Zoo Atlanta,Zoo Montana,,"
"Hotel in Alabama",",Alabama,Birmingham Alabama,Mobile,Montgomery,,Arlington Antebellum Home and Gardens,Birmingham Civil Rights Institute,Birmingham Zoo,Oak Mountain State Park,Russell Cave National Monument,Talladega Superspeedway,Vulcan Park,,"
"Hotel in Alaska",",Alaska,Anchorage,Fairbanks,Juneau,Ketchikan,Skagway,The Inside Passage,,Alaska Native Heritage Center,Alaskan Ferry,Anchorage Museum of History and Art,Denali National Park and Preserve,Glacier Bay National Park,Hubbard Glacier,Ketchikan,Mendenhall Glacier,,"
"Hotel in Alberta",",Alberta,Calgary,Canadian Rocky Mountains,Edmonton,,Banff,Calaway Park,Calgary Tower,Calgary Zoo,Canada Olympic Park,Columbia Icefields,Fort Calgary,Glenbow Museum,Head-Smashed-In Buffalo Jump,Heritage Park Historical Village,Jasper,Moraine Lake,Lake Louise,"
"Hotel in Arizona",",Arizona,Phoenix,Sedona,Tucson,,Arizona-Sonora Desert Museum,Colossal Cave Mountain Park,DeGrazia Gallery in the Sun,Desert Botanical Garden,Heard Museum,Kartchner Caverns State Park,Kingman,Lake Mead and Hoover Dam,Petrified Forest National Park,Philabaum Glass,Pueblo Grande Museum and Archaeological Park,Sabino Canyon,Taliesin West,The Grand Canyon,The Mission San Xavier del Bac,Tombstone,Trail Dust Town,Tucson Botanical Gardens,Tucson Rodeo Parade Museum,University of Arizona Art Museum,Valley of the Moon,,"
"Hotel in Arkansas",",Arkansas,Little Rock,,Arkansas Governors Mansion,Clinton Presidential Center,Hot Springs,Little Rock Nine Memorial,,"
"Hotel in British Columbia",",British Columbia,Ski Resorts,Vancouver,Vancouver Island,,British Columbia Parliament Buildings,Butchart Gardens,Capilano Suspension Bridge,Chinatown,Commercial Drive,Fairmont Empress Hotel,Gastown,Granville Island,Greater Vancouver Zoo,Grouse Mountain,Gulf Islands,Lonsdale Quay,Museum of Anthropology,Othello Tunnels,Queen Elizabeth Park,San Juan Islands,Stanley Park,Vancouver Aquarium Marine Science Centre,Vancouver Art Gallery,Vancouver Lookout at the Harbour Centre,VanDusen Botanical Garden,,"
"Hotel in California",",California,Central Coast,Los Angeles,North Coast Redwoods District,San Diego,San Francisco,San Jose,,Alamo Square,Alcatraz,Anaheim,Aquarium of the Bay,Aquatica by Seaworld,Asian Art Museum of San Francisco,Balboa Park,Beach Communities,Cable Cars,Castle Park,Celebrity Gravesites,Childrens Fairyland,Chinatown,Coit Tower,Coronado Island,Death Valley National Park,Disneyland Resort,Downtown San Diego,Exploratorium,Fishermans Wharf,Getty Center,Getty Villa,Ghirardelli Square,Golden Gate Bridge,Golden Gate Park,Griffith Park and Observatory,Haight Ashbury,Hearst Castle,Hollywood,Joshua Tree National Park,Knotts Berry Farm,La Brea Tar Pits,Legoland California,Lombard Street,Los Angeles Zoo,Magicopolis,Medieval Times,Monterey,Muir Woods,North Beach,Oakland Zoo,Peach Tree Pottery,Pinnacles National Monument,Randall Museum,Redwood National and State Park,Ripleys Believe it or Not! Museum,San Diego Beaches,San Diego Wine Country,San Diego Zoo and Safari Park,San Francisco MOMA,Santa Barbara,Santa Cruz,Santa Cruz Beach Boardwalk,Sausalito,SeaWorld,Six Flags Discovery Kingdom,Six Flags Magic Mountain,Tijuana, Mexico,Union Square,Universal Studios Hollywood,Walt Disney Concert Hall,Warner Bros Studios,West LA,Winchester Mystery House,Wine Country,Yosemite National Park,,"
"Hotel in Capital Territory",",Capital Territory,Canberra,Canberra International,Australian War Memorial,Cockington Green,National Gallery of Australia,,"
"Hotel in Channel Islands",",Channel Islands,Alderney,Guernsey,Jersey,Sark,,,,"
"Hotel in Colorado",",Colorado,Colorado Springs,Denver,Rocky Mountains,,Boulder,Denver Art Museum,Denver Mint,Denver Museum of Nature and Science,Dinosaur National Monument,Elitch Gardens Theme Park,History Colorado Center,Mesa Verde National Park,Mount Evans,Rocky Mountain National Park,Ski resorts,,"
"Hotel in Connecticut",",Connecticut,Hartford,New Haven,Bradley Airport,Freedom Schooner Amistad,Mark Twain House and Museum,Mystic Seaport,Old State House,Peabody Museum of Natural History,Wadsworth Atheneum Museum of Art,Yale University,,"
"Hotel in Delaware",",Delaware,Wilmington,Philadelphia International Airport,Delaware Art Museum,Delaware Museum of Natural History,Hagley Museum and Library,The Delaware Contemporary,,"
"Hotel in England",",England,Bath,Birmingham,Brighton,Bristol,Cambridge,Durham,East Anglia,Isle of Wight,Leeds,Liverpool,London,Manchester,Newcastle-Upon-Tyne,Nottingham,Oxford,Plymouth,Southwest England,The Cotswolds,The Lake District,York,,Abbey House Museum,Abbey Road Studios,Alton Towers,Armley Mills Industrial Museum,Ashmolean Museum,Avon Valley Adventure and Wildlife Park,Balti Triangle,BALTIC Centre for Contemporary Art,Barber Institute of Fine Arts,Beatles Story Experience,Berkeley Castle,Big Ben and the Houses of Parliament,Birmingham Museum and Art Gallery,Blickling Estate,Bodleian Library,Borough Market,Bridgewater Hall,Brighton Lanes,Brighton Palace Pier,Bristol Cathedral,Bristol City Museum and Art Gallery,Bristol Zoo and Garden,British Museum,Buckingham Palace and the Queens Gallery,Building of Bath Museum,Camden Market,Canterbury,Carfax Tower,Castle Howard,Castle Keep and New Castle,Castlerigg Stone Circle,Chatsworth House,Cheddar Gorge,Chessington World of Adventures,Christchurch Picture Gallery,Church of St Mary the Great,City of Caves,Cresswell Crags,Crook Hall,Dove Cottage and the William Wordsworth Museum,Drayton Manor Theme Park,Ducal Mansion (Nottingham Castle),Durham Castle,Durham Cathedral,Durham Heritage Centre,Fashion Museum,Fowlers Yard Creative Workspaces,Gloucester,Greenwich,Grizedale Forest,Hadrians Wall,Hamleys,Hampton Court Palace,Harrods,Herschel Museum of Astronomy,Hill Top,Holker Estate,Holkham Hall,Imperial War Museum,Jane Austen Centre,Jorvik Viking Centre,Kettles Yard,Kings College Chapel,Leeds Art Gallery,Leeds Castle,London Dungeons,London Eye,London Science Museum,London Zoo,Longleat,Madame Tussauds,Merseyside Maritime Museum,Museum of Science and Industry,National Gallery,Natural History Museum,Norfolk Broads,Norwich,Old Trafford,Oxford Botanic Gardens,Peak District,Penzance,Piccadilly Circus,Roman Baths,Royal Armouries Museum,Royal Pavilion,Salisbury Cathedral,Selfridges Store,Shakespeares Globe Theatre,Sherwood Forest,Speakers Corner at Hyde Park,Speke Hall,St Pauls Cathedral,Stonehenge,Stratford-Upon-Avon,Sudeley Castle,Tate Liverpool,Tate Modern,Thackray Museum,The Eden Project,The Fitzwilliam Museum,The Sedgwick Museum of Earth Sciences,Tower Bridge,Tower of London,University of Cambridge,Victoria and Albert Museum,Warwick Castle,West End Shows,Westminster Abbey,Windermere,Windsor Castle,York Dungeons,York Minster,,"
"Hotel in Florida",",Florida,Florida Keys,Fort Lauderdale,Gold Coast,Gulf Coast,Jacksonville,Miami,Orlando,Pensacola,St Petersburg Florida,Tampa,,Amelia Island,Audubon House and Tropical Gardens,Biscayne National Park,Busch Gardens,Butterfly Conservatory,Coral Castle,Crandon Park Beach,Crane Point,Discovery Cove Orlando,Dolphin Research Center,Edison and Ford Winter Estates,Ernest Hemingway Home and Museum,Everglades National Park,Fantasy of Flight,Florida Aquarium,Gatorland,Gold Coast Railroad Museum,Gulf Islands National Seashore,Gumbo Limbo Environmental Complex,Henry B. Plant Museum,Jungle Island,Kennedy Space Centre,Key Largo,Key West Lighthouse Museum,Koreshan State Historic Site,Lee County Manatee Park,Lincoln Road Mall,Marathon,Marine Life Center of Juno Beach,Miami Beaches,Miami Childrens Museum,Miami Science Museum,Miami Seaquarium,Museum of Science and Industry,National Key Deer Refuge,National Museum of Naval Aviation,Norton Museum of Art,Orlando Museum of Art,Orlando Odditorium,Panama City,Pigeon Key,SeaWorld Aquatica,SeaWorld Orlando,Seminole Reservation,Shell Factory and Nature Park,Southwest Florida Museum of History,Spanish Monastery,Tallahassee,Tampa Museum of Art,The Holy Land Experience,Universal Studios Florida,Vizcaya Villa,Walt Disney World,Wet n Wild Orlando,Wizarding World of Harry Potter,Wolfsonian Museum,Ybor City,,"
"Hotel in Georgia",",Georgia,Atlanta,Savannah,,Atlanta Botanical Garden,Atlanta History Center,Darien,Davenport House,Ebenezer Baptist Church,Fernbank Museum of Natural History,Fort Jackson,Georgia Aquarium,Georgia Mountains,High Museum of Art,Imagine It! Childrens Museum of Atlanta,Jonesboro,Kennesaw Mountain Battlefield,Martin Luther King Jr National Historic Site,Monetary Museum at the Federal Reserve Bank,Okefenokee Swamp,Savannah History Museum,Six Flags Over Georgia,Stone Mountain Park,Telfair Museum of Art,The Fox Theatre,Turner Field,Tybee Island,World Of Coca-Cola,Zoo Atlanta,,"
"Hotel in Hawaii",",Hawaii,Big Island,Honolulu,Kauai,Lanai,Maui,Molokai,Oahu,,Baldwin Home Museum,Bishop Museum,Diamond Head Crater,Haleakala National Park,Hana Highway,Hawaii Volcanoes National Park,Hilo,Honolulus Chinatown,Hulihee Palace,Iolani Palace,Kalalau Trail,Kona Coffee Museum and Farm,Maui Ocean Centre,Napali Coast State Wilderness Park,Oahu Beaches,Pacific Tsunami Museum,Polynesian Cultural Centre,Puuhonua O Honaunau National Historical Park,Surfing in Oahu,USS Arizona Memorial Museum,Valley of the Temples,Waikiki Aquarium,Whalers Village Museum,,"
"Hotel in Idaho",",Idaho,Boise,,Basque Museum and Cultural Center,Bogus Basin Mountain Recreation Area,Craters of the Moon,Sun Valley,"
"Hotel in Illinois",",Illinois,Chicago,Springfield,,Adler Planetarium and Astronomy Museum,Art Institute of Chicago,Buckingham Fountain,Chicago Beaches,Chicago Botanic Gardens,Chicago Childrens Museum,Chicago Field Museum,Chicago History Museum,Chicago Loop,Frank Lloyd Wrights Home,Hancock Observatory,Knights Action Park and Caribbean Water Adventure,Lincoln Library and Museum,Lincoln Park,Lincolns Home,Magnificent Mile,Millennium Park,Navy Pier,Oak Ridge Cemetery,Rockford,Route 66 Sign,Sears Tower (Willis Tower),Shedd Aquarium,Six Flags Great America,,"
"Hotel in Indiana",",Indiana,Indianapolis,,Eiteljorg Museum of American Indians and Western Art,Indianapolis Motor Speedway,NCAA Hall of Champions,,"
"Hotel in Iowa",",Iowa,Des Moines,Iowa City,West Okoboji Lake,,,,"
"Hotel in Kansas",",Kansas,,Wichita Airport,,,"
"Hotel in Kentucky",",Kentucky,Louisville,,Belle of Louisville,Cathedral of the Assumption,Churchill Downs,Fort Knox,Frankfort,Kentucky Derby Museum,Kentucky Horse Park,Kentucky Science Center,Louisville Glassworks,Mammoth Cave,Muhammad Ali Center,Thomas Edisons House,Woodford Reserve Distillery,,"
"Hotel in Louisiana",",Louisiana,Baton Rouge,New Orleans,,Audubon Aquarium of the Americas,Avery Island,French Quarter,Grand Isle,Hurricane Katrina Tour,Jean Lafitte National Historical Park and Preserve,Lafayette,Louisiana Art and Science Museum,Louisiana Childrens Museum,Louisiana State Museum,Mardi Gras World,Mississippi River Boat Rides,New Orleans Museum of Art,Old State Capitol,Preservation Hall,Rural Life Museum and Windrush Gardens,San Francisco Plantation,The National WWII Museum,USS Kidd Veterans Museum,,"
"Hotel in Maine",",Maine,Maine Ski Resorts,Mount Desert Island,Portland,,Kennebunkport,Old Orchard Beach,Portland Downtown Arts District,Portland Head Light,Rockland,Wadsworth-Longfellow House,,"
